{
  "protocol_version": "1.0.0",
  "run_id": "fixture-business",
  "applicant_alias": "Applicant B",
  "mode": "local",
  "created_at": "2026-10-28T05:37:49Z",
  "current_phase": "merge",
  "sessions": [
    {
      "n": 1,
      "started_at": "2026-10-20T09:00:00Z",
      "ended_at": "2026-10-21T09:45:00Z",
      "phase": "search",
      "outcome": "complete",
      "limit_hit": false,
      "agents_run": 4,
      "wave": 1
    }
  ],
  "checkpoints": [
    {
      "file": "04_search/countries/southvale.json",
      "status": "complete",
      "updated_at": "2026-10-20T11:00:00Z",
      "records": 4
    },
    {
      "file": "04_search/countries/westmarch.json",
      "status": "complete",
      "updated_at": "2026-10-21T09:45:00Z",
      "records": 1
    }
  ],
  "assumptions": [],
  "overrides_of_protocol": [],
  "next_action": "Run merge.py, then sample_verification.py.",
  "agents_per_window_observed": 4.0,
  "state_vector": {
    "run": "fixture-business",
    "session": 1,
    "date": "2026-10-25",
    "phase": "search -> merge",
    "session_objective": "Merge the two country files.",
    "context": [
      "Synthetic fixture."
    ],
    "unknowns": [],
    "ambiguities": [],
    "assumptions": [],
    "completed": [
      "Life plan and pathway map passed",
      "Southvale and Westmarch searched"
    ],
    "active": {
      "user": [],
      "virgil": []
    },
    "next": {
      "user": [],
      "virgil": [
        "Run merge.py, then sample_verification.py"
      ]
    },
    "blockers": [],
    "artifacts": [
      "04_search/countries/southvale.json"
    ]
  }
}
