{
  "protocol_version": "1.0.0",
  "run_id": "fixture-run",
  "applicant_alias": "Applicant T",
  "mode": "local",
  "created_at": "2026-10-28T05:37:49Z",
  "current_phase": "followups",
  "sessions": [
    {
      "n": 1,
      "started_at": "2026-10-20T09:00:00Z",
      "ended_at": "2026-10-20T11:30:00Z",
      "phase": "search",
      "outcome": "limit_hit",
      "limit_hit": true,
      "agents_run": 3,
      "wave": 1
    }
  ],
  "checkpoints": [
    {
      "file": "04_search/countries/northland.json",
      "status": "partial_budget_exhausted",
      "updated_at": "2026-10-20T11:30:00Z",
      "records": 3
    },
    {
      "file": "04_search/countries/eastmark.json",
      "status": "complete_with_gaps",
      "updated_at": "2026-10-21T10:30:00Z",
      "records": 2
    },
    {
      "file": "04_search/followups/northland_followup.json",
      "status": "complete",
      "updated_at": "2026-10-22T10:00:00Z",
      "records": 2
    }
  ],
  "assumptions": [
    {
      "id": "A1",
      "text": "Savings cover living costs for the whole degree.",
      "made_in": "session 1, life_plan",
      "revisit": true
    }
  ],
  "overrides_of_protocol": [],
  "next_action": "Run followups.py then merge.py.",
  "agents_per_window_observed": 3.0,
  "state_vector": {
    "run": "fixture-run",
    "session": 1,
    "date": "2026-10-25",
    "phase": "search -> followups",
    "session_objective": "Run follow-ups for the Northland gaps.",
    "context": [
      "Synthetic fixture."
    ],
    "unknowns": [
      "Northland Path B"
    ],
    "ambiguities": [],
    "assumptions": [
      {
        "text": "Savings cover living costs.",
        "basis": "stated in the interview"
      }
    ],
    "completed": [
      "Life plan and pathway map passed",
      "Northland first pass (partial)",
      "Eastmark pass"
    ],
    "active": {
      "user": [],
      "virgil": []
    },
    "next": {
      "user": [
        "Review the follow-up triggers"
      ],
      "virgil": [
        "Run followups.py, then merge.py"
      ]
    },
    "blockers": [
      {
        "item": "Marsh Polytechnic portal blocked",
        "owner": "EXTERNAL"
      }
    ],
    "artifacts": [
      "04_search/countries/northland.json",
      "04_search/countries/eastmark.json"
    ]
  }
}
